{
  "profileVersion": 1,
  "id": "ai-hard",
  "name": "Hard",
  "description": "Coordinates faction objectives with resource forecasts, assesses rivals by public strength and possible Hidden LP, and chooses complementary partners.",
  "difficulty": "hard",
  "planning": {
    "beamWidth": 44,
    "candidateLimit": 90,
    "maxOrders": 11,
    "threatHorizon": 3,
    "riskTolerance": 0.55,
    "reserveByEra": [
      0,
      1,
      2,
      3
    ],
    "uncertaintyPenalty": 0.34,
    "diplomacyHorizon": 3,
    "gateSafetyMargin": 2,
    "forecastHorizon": 4,
    "minimumGateConfidence": 0.86
  },
  "priorities": {
    "legacy": 1.52,
    "economy": 1.48,
    "technology": 1.34,
    "expansion": 1.5,
    "military": 1.18,
    "diplomacy": 1.45,
    "gate": 1.3,
    "denial": 1.2,
    "survival": 1.34
  },
  "technology": {
    "Military": 1.05,
    "Economy": 1.18,
    "Policy": 1.1,
    "Exploration": 1.16,
    "Resource": 1.16
  },
  "behaviors": {
    "punishFreeRiders": false,
    "avoidMutualDestruction": true,
    "protectGateCompletion": true,
    "preferFlexibleResources": true,
    "exploitFactionSynergy": true,
    "recordCounterfactuals": true,
    "coordinateGateSupport": true,
    "useMarketForGate": true,
    "modelOpponents": true,
    "routeColonies": true,
    "redTeamNotebook": true,
    "multiTurnPlanning": true,
    "factionDoctrine": true,
    "victoryImpact": true
  }
}
