{
  "profileVersion": 1,
  "id": "ai-medium",
  "name": "Medium",
  "description": "Builds an economy and pursues attainable Civilization, Universal, and Hidden objectives while keeping the Gate viable.",
  "difficulty": "medium",
  "planning": {
    "beamWidth": 24,
    "candidateLimit": 60,
    "maxOrders": 9,
    "threatHorizon": 2,
    "riskTolerance": 0.55,
    "reserveByEra": [
      0,
      1,
      2,
      3
    ],
    "uncertaintyPenalty": 0.34,
    "diplomacyHorizon": 3,
    "gateSafetyMargin": 2,
    "forecastHorizon": 3,
    "minimumGateConfidence": 0.86
  },
  "priorities": {
    "legacy": 1.22,
    "economy": 1.32,
    "technology": 1.34,
    "expansion": 1.35,
    "military": 0.85,
    "diplomacy": 1.15,
    "gate": 1.3,
    "denial": 0.42,
    "survival": 1.34
  },
  "technology": {
    "Military": 1.05,
    "Economy": 1.18,
    "Policy": 1.1,
    "Exploration": 1.16,
    "Resource": 1.16
  },
  "behaviors": {
    "punishFreeRiders": false,
    "avoidMutualDestruction": true,
    "protectGateCompletion": true,
    "preferFlexibleResources": true,
    "exploitFactionSynergy": true,
    "recordCounterfactuals": false,
    "coordinateGateSupport": true,
    "useMarketForGate": true,
    "modelOpponents": true,
    "routeColonies": true,
    "redTeamNotebook": false,
    "multiTurnPlanning": true,
    "factionDoctrine": true,
    "victoryImpact": false
  }
}
